{
  "schema_version": "0.1.0",
  "screen_id": "mac_0003",
  "image": {
    "path": "source.png",
    "sha256": "59d867374d164db5ad1efc23f768b4883ec7a64b146a35a46e8ade380520617f",
    "width": 1446,
    "height": 1606,
    "scale_factor": 2.0,
    "coordinate_space": "source_pixels_xyxy"
  },
  "screen_context": {
    "description": "A native macOS System Settings window showing the Appearance preference pane in dark mode, with controls for Light/Dark theme, Liquid Glass, accent colour swatches, and window tinting options.",
    "view_types": [
      "settings",
      "preferences_view"
    ],
    "visible_app_names": [
      "System Settings"
    ],
    "uncertainties": []
  },
  "nodes": [
    {
      "id": "n_0000",
      "level": "screen",
      "bbox": [
        0,
        0,
        1446,
        1606
      ],
      "parent_id": null,
      "proposal_ids": [],
      "box_status": "added",
      "role": "screen",
      "semantic_name": "Full Screen Canvas",
      "description": "macOS System Settings Appearance pane displayed in dark mode.",
      "context_description": "Full screen canvas enclosing the System Settings window.",
      "function": null,
      "surface": "native_app_ui",
      "content_type": "container",
      "visible_text": [],
      "state": {
        "selected": "not_applicable",
        "checked": "not_applicable",
        "expanded": "not_applicable",
        "disabled_appearance": "not_applicable"
      },
      "evidence": [
        "Display bounds"
      ],
      "uncertainties": [],
      "review_status": "reviewed_correct"
    },
    {
      "id": "n_0001",
      "level": "window",
      "bbox": [
        0,
        0,
        1446,
        1606
      ],
      "parent_id": "n_0000",
      "proposal_ids": [],
      "box_status": "added",
      "role": "window",
      "semantic_name": "System Settings Window",
      "description": "Primary macOS System Settings window containing navigation sidebar and Appearance settings panel.",
      "context_description": "Encloses sidebar on the left and settings form on the right.",
      "function": null,
      "surface": "native_app_ui",
      "content_type": "container",
      "visible_text": [],
      "state": {
        "selected": "true",
        "checked": "not_applicable",
        "expanded": "not_applicable",
        "disabled_appearance": "false"
      },
      "evidence": [
        "macOS window frame with sidebar and settings form"
      ],
      "uncertainties": [],
      "review_status": "reviewed_correct"
    },
    {
      "id": "n_0002",
      "level": "region",
      "bbox": [
        0,
        0,
        440,
        1606
      ],
      "parent_id": "n_0001",
      "proposal_ids": [],
      "box_status": "added",
      "role": "sidebar",
      "semantic_name": "Settings Categories Sidebar",
      "description": "Left vertical navigation sidebar listing preference categories including Wi-Fi, Appearance, Displays, and Sound.",
      "context_description": "Left navigation column of System Settings.",
      "function": {
        "label": "switch_settings_category",
        "description": "Navigate between preference panes",
        "status": "observed"
      },
      "surface": "native_app_ui",
      "content_type": "container",
      "visible_text": [
        {
          "text": "Appearance",
          "bbox": [
            100,
            500,
            240,
            530
          ],
          "legibility": "legible"
        },
        {
          "text": "Wi-Fi",
          "bbox": [
            100,
            205,
            175,
            230
          ],
          "legibility": "legible"
        },
        {
          "text": "Bluetooth",
          "bbox": [
            100,
            250,
            230,
            275
          ],
          "legibility": "legible"
        },
        {
          "text": "Displays",
          "bbox": [
            100,
            625,
            210,
            650
          ],
          "legibility": "legible"
        }
      ],
      "state": {
        "selected": "not_applicable",
        "checked": "not_applicable",
        "expanded": "not_applicable",
        "disabled_appearance": "false"
      },
      "evidence": [
        "Scrollable list of macOS preference category icons and labels"
      ],
      "uncertainties": [],
      "review_status": "reviewed_correct"
    },
    {
      "id": "n_0003",
      "level": "region",
      "bbox": [
        440,
        0,
        1446,
        110
      ],
      "parent_id": "n_0001",
      "proposal_ids": [
        "d_0030"
      ],
      "box_status": "retained",
      "role": "toolbar",
      "semantic_name": "Settings Toolbar",
      "description": "Top toolbar of settings pane with back/forward history navigation and Appearance title.",
      "context_description": "Header above settings form content.",
      "function": {
        "label": "navigate_settings_history",
        "description": "Back and forward navigation",
        "status": "observed"
      },
      "surface": "native_app_ui",
      "content_type": "container",
      "visible_text": [
        {
          "text": "Appearance",
          "bbox": [
            590,
            30,
            760,
            65
          ],
          "legibility": "legible"
        }
      ],
      "state": {
        "selected": "not_applicable",
        "checked": "not_applicable",
        "expanded": "not_applicable",
        "disabled_appearance": "false"
      },
      "evidence": [
        "Toolbar strip with navigation chevrons and heading"
      ],
      "uncertainties": [],
      "review_status": "reviewed_correct"
    },
    {
      "id": "n_0004",
      "level": "region",
      "bbox": [
        440,
        110,
        1446,
        1606
      ],
      "parent_id": "n_0001",
      "proposal_ids": [],
      "box_status": "added",
      "role": "main_content",
      "semantic_name": "Appearance Options Workspace",
      "description": "Main scrollable form containing controls for light/dark mode, accent colors, icon style, and window behavior.",
      "context_description": "Central content workspace of Appearance settings.",
      "function": {
        "label": "configure_appearance",
        "description": "Customize macOS visual theme and colors",
        "status": "observed"
      },
      "surface": "native_app_ui",
      "content_type": "container",
      "visible_text": [],
      "state": {
        "selected": "not_applicable",
        "checked": "not_applicable",
        "expanded": "not_applicable",
        "disabled_appearance": "false"
      },
      "evidence": [
        "Cards and form sections for macOS appearance customization"
      ],
      "uncertainties": [],
      "review_status": "reviewed_correct"
    },
    {
      "id": "n_0101",
      "level": "element",
      "bbox": [
        31.16,
        33.12,
        163.75,
        71.56
      ],
      "parent_id": "n_0002",
      "proposal_ids": [
        "d_0043"
      ],
      "box_status": "retained",
      "role": "button_group",
      "semantic_name": "Window Traffic Lights",
      "description": "Standard macOS traffic light close, minimize, and zoom controls.",
      "context_description": "Upper left of sidebar.",
      "function": {
        "label": "manage_window",
        "description": "Close or minimize window",
        "status": "inferred"
      },
      "surface": "native_app_ui",
      "content_type": "control",
      "visible_text": [],
      "state": {
        "selected": "not_applicable",
        "checked": "not_applicable",
        "expanded": "not_applicable",
        "disabled_appearance": "false"
      },
      "evidence": [
        "Red, yellow, green circular glyphs"
      ],
      "uncertainties": [],
      "review_status": "reviewed_correct"
    },
    {
      "id": "n_0102",
      "level": "element",
      "bbox": [
        25.52,
        120.37,
        429.49,
        180.77
      ],
      "parent_id": "n_0002",
      "proposal_ids": [
        "d_0029"
      ],
      "box_status": "retained",
      "role": "text_input",
      "semantic_name": "Settings Search Field",
      "description": "Search bar with magnifying glass icon and placeholder Search.",
      "context_description": "Directly below window controls in sidebar.",
      "function": {
        "label": "search_settings",
        "description": "Search for settings and preference panes",
        "status": "observed"
      },
      "surface": "native_app_ui",
      "content_type": "control",
      "visible_text": [
        {
          "text": "Search",
          "bbox": [
            85,
            115,
            175,
            145
          ],
          "legibility": "legible"
        }
      ],
      "state": {
        "selected": "false",
        "checked": "not_applicable",
        "expanded": "false",
        "disabled_appearance": "false"
      },
      "evidence": [
        "Rounded rectangle text box with search icon"
      ],
      "uncertainties": [],
      "review_status": "reviewed_correct"
    },
    {
      "id": "n_0103",
      "level": "element",
      "bbox": [
        31.83,
        191.37,
        439.17,
        316.54
      ],
      "parent_id": "n_0002",
      "proposal_ids": [
        "d_0001"
      ],
      "box_status": "retained",
      "role": "card",
      "semantic_name": "Redacted Account Banner",
      "description": "User account banner, redacted per privacy guidelines.",
      "context_description": "Below search bar in sidebar.",
      "function": null,
      "surface": "native_app_ui",
      "content_type": "container",
      "visible_text": [],
      "state": {
        "selected": "not_applicable",
        "checked": "not_applicable",
        "expanded": "not_applicable",
        "disabled_appearance": "not_applicable"
      },
      "evidence": [
        "Redaction mask applied"
      ],
      "uncertainties": [
        "User identity intentionally redacted"
      ],